Sheet: Sheet1
A2: Num of Sub-carriers | B2: 512 | G2: Payload (Bytes) | H2: 3000
A3: Fraction of Pilots | B3: of:=1/4 -> 0.25 | C3: of:=[.B2]*[.B3] -> 128 | G3: CRC | H3: 32
A4: Fraction of NULLS | B4: of:=1/8 -> 0.125 | C4: of:=[.B2]*[.B4] -> 64 | G4: Mod Scheme(k) | H4: 5
A5: Data Sub-carriers | C5: of:=[.B2]-[.C3]-[.C4] -> 320 | G5: FEC Rate | H5: 1
A7: Cyclic Prefix | B7: 32
A10: Sym per OFDM | B10: of:=[.B2]+[.B7] -> 544 | G10: Total Bits | H10: of:=[.H2]*8+[.H3] -> 24032
G11: Total Symbols | H11: of:=([.H10]/[.H4])/[.H5] -> 4806.4
A14: S0 | B14: 2
A15: S1 | B15: 1
A16: Header | B16: of:=ROUNDUP(256/[.C5]) -> 1
A17: Payload | B17: of:=ROUNDUP([.H11]/[.C5]) -> 16
A19: Transmitted Symbols | B19: of:=([.B14]+[.B15]+[.B16]+[.B17])*[.B10] -> 10880
A20: Bandwidth Efficiency | B20: of:=[.H10]/[.B19] -> 2.20882352941176